,IMDB,RT,Direccion,Guión,Argumento,Duración,Título
220,--,--,Ryan Sharp,Ryan Sharp,"This sketch comedy series is fresh, hilarious, and always engaging! Skits were often created with random public citizens in real public locations. The cast, included Ryan Sharp, Dustin Boes, Doug Rideway, and Walter Cherry. They were able to become a variety of different characters throughout the series that were always very funny. Content is fairly clean and family f... Read all",--,Saturday Night Crackups
221,6.7,--,Lionel Soukaz,José Cunéo,Add a plot,4m,La cuisine de Cunéo
222,5.5,--,Samuel Vartek,Samuel Vartek,"Surreal dark comedy/tragedy centering on the romantic tragedies of clockmaker Richard Dock, who must navigate through a Kafka fantasy world and choose whether or not to save his ex-wife's life by killing an innocent woman.",10m,Holiday on the Moon
223,--,--,R.J. Fox,R.J. Fox,A man goes to great lengths to avoid some unwanted guests.,--,Jehovah's Unwitnessed
224,6.4,--,Spike Brandt,Earl KressKathleen Helppie-Shipley,"Baby Wile E. Coyote is told by his father, Cage E., that he's not to speak until he catches a roadrunner. Wile E. tries several products from Acme Jr., including a jack-in-the-box and a water-rocket-propelled bike. They maintain the fine tradition of Acme quality products.",8m,Little Go Beep
225,6.7,--,Todd Portugal,Steve Oedekerk,A parody story about the sinking of the unsinkable ship,26m,Thumbtanic
226,8.0,88%,Ralph Eggleston,Ralph Eggleston,A group of snooty birds roosting on a telephone wire get their just deserts when a goofy bird drops in.,3m,For the Birds
227,7.3,--,Luke Greenfield,Luke GreenfieldDavid Scotti,"You all know Bruno...Bruno is a born loser with the ladies. Scoffed and scorned, the only thing Bruno could pick up in a singles' bar is the check! Until now. Now Bruno sees the girl of his dreams and he'll fight all odds to win her - even her lesbian girlfriend. In a 10-minute brawl of hilarity, Bruno finds ""The Right Hook,"" a short film that asks the age-old questio... Read all",10m,The Right Hook
228,7.2,--,Fernando Altamirano,Iréne Eltebo,,18m,Gropen
229,--,--,Stefan Lampadius,Stefan LampadiusThomas Lang,A man from Kosovo wants to become a German citizen. A German official does not.,5m,Der Nächste bitte!
230,--,--,Marko Nabersnik,Marko Nabersnik,"What should we do, if we are not happy with our lives? It's simple. A moment is enough for us to take a plunge. And nothing is the same as before.",18m,Z ljubeznijo
231,--,--,Brian Michael Finn,Mike May,A young man of questionable sanity carries on his day holding conversations with his doll friend whom no one else can see.,23m,Mike & Bill
232,6.3,--,Lincoln Kupchak,Lincoln Kupchak,"Another group of young people travels to Paradise Hot Tubs and is quickly dispatched by the psycho killer, Derrick.",5m,Hot Tubs II: The Terror Returns
233,7.4,--,Virgil Widrich,Virgil Widrich,"Unknowingly, a copy shop employee sets off a bizarre series of events with utterly unforeseen consequences.",12m,Copy Shop
234,8.1,--,Elizabeth Allen Rosenbaum,Nick Pustay,"""Eyeball Eddie"" is the story of the stormy relationship between a prosthetic glass eye and the insecure boy stuck behind it. What follows is a dark comedy about the price of popularity. In the world of high-school wrestling, there is only the strong and the weak - and EDDIE MALICK may be the weakest you've ever seen. Shy, scrawny, and perpetually body-slammed, Eddie s... Read all",29m,Eyeball Eddie
235,--,--,Stacey L. HolmanJeffrey Starr,Stacey L. Holman,A pampered twenty-something African-American woman learns to face the realities of adult life with help of her three girlfriends in a book club.,2m,Girl Talk
236,8.3,--,John Mossman,Laura LeeTim MillerJohn Mossman,A Milwaukee housewife who is a Jello champion in the early 1960's dreams of freedom in 'The American West' as she tries to balance her goals with real life.,22m,Jell-Ohh Lady
237,8.5,--,Tom Blomquist,Geoff Koch,Add a plot,--,Prison Life
238,--,--,Amy Klitsner,Sara C. CaldwellAnna Maria Prezio,"When Sierra's boyfriend finds her a free place to stay, she's thrilled. But when the inhabitants of the Topanga residence make her question her sanity, she discovers they're caught in a deadly game that ends in the crawl space.",26m,Crawl Space
239,7.0,--,Mark Goffman,Mark Goffman,,--,Studio Notes
240,--,--,Angus Strachan,Angus Strachan,"When the gun-totin Blonde Babes from Hell steal their boyfriends, the three bandito Amigo Sisters ride into Sydney town and go the ballistic biff 'n bash to get their Boofy-Blokes back... Ole!",--,Hey Amigos!
241,8.4,--,Massimo Stella,Massimo Stella,Every choice has consequences. So: are you sure that you want to watch this tape?,13m,Brusdlainz
242,--,--,Josh AppignanesiMisha Manson-Smith,James Rawlings,"Satire about class in the spoof documentary form, The Brixtonian describes the world of an upper-class white trustafarian who thinks he's a rasta. The mock doc and white guys who think they are black may seem old hat now, but this short actually pre-dates Ali G by a couple of years.",11m,The Brixtonian
243,7.9,--,Stefan PrehnJörg Wagner,Jörg WagnerStefan Prehn,Short film depicting a fictional educational film about fork lift truck operational safety. The dangers of unsafe operation are presented in gory details.,10m,Forklift Driver Klaus: The First Day on the Job
244,--,--,Danddara,DanddaraRodrigo Guéron,A young musician and community leader dies unexpectedly and the Mangueria samba school community gathers to honor him. Surprising things are going to happen during this strange ceremony.,--,Gurufim na Mangueira
245,7.0,--,Johannes Kiefer,Johannes Kiefer,"Gregor, a young man, lives with and cares for his elderly grandmother. He's also a bit of an inventor. One day, when her wheelchair accidentally rolls down a hill and throws her into a pond, he gets an idea for an invention: A harness system that will let his grandmother walk again by supporting her weight. Meanwhile, her friends from the nursing home are trying to co... Read all",11m,Gregors größte Erfindung
246,6.3,--,Philip John,Philip John,A lethal tale of nun-upmanship.,5m,Sister Lulu
247,7.6,17%,John MacInnes,John MacInnes,"When Jeremy sets out to learn the piano, perhaps the greatest obstacle in his path to 'reach chopsticks standard' is not his own musical dyslexia, but his blind faith in his tyrannical tutor - the tempestuous Stromberg.",14m,Chopsticks
248,--,--,Chris Cuthbertson,Chris CuthbertsonNico Lorenzutti,,2m,Squeegee School
249,--,--,Dmitry Torgovitsky,Dmitry Torgovitsky,,8m,PUGSLY a.k.a. Manhattan Dog Story
250,--,--,Roop Singh Sood,Roop Singh Sood,,--,Love's Crazy
251,5.8,--,Olivier Leyronnas,Alexandre Astier,Add a plot,12m,Soyons Sport
252,7.7,--,Nick Lyon,Nick Lyon,"A young girl grows up. In the beginning, she seems to be a normal girl, but later her decisions begin to be somewhat different.",20m,Hilda Humphrey
253,8.4,--,Hyunjin Jo,Hyunjin Jo,,--,Basic Items
254,8.6,--,Ken Tipton,Ken Tipton,"A man assumes his date's ""special"" son is retarded. Actually, he is a 12-year-old genius. An intellectual battle ensues between the ""brain"" and the ""blind from hell"". At stake is the woman's virtue.",14m,Special
255,6.1,--,Lee Demarbre,Ian Driscoll,"Harry Knuckles (code name Spanish Fly) must stop his nemesis who has kidnapped his daughter and poisoned her. Harry and his partner, Santo must find the serum that can save her and stop the ancient Aztec Mummy and it's evil zombies that pursue.",27m,Harry Knuckles and the Treasure of the Aztec Mummy
256,7.6,--,Jonah Kaplan,Jonah KaplanMarc Maron,"A new form of urban angst rules this neurotic comedy about an inadvertent battle of wills between the sexes. The action begins on the subway, when Marc determines that the woman across from him likes his goods. The tension escalates as they both exit at the same stop and their progress continues side-by-side. His fantasy turns to terror as he realizes that she must th... Read all",11m,Stalker Guilt Syndrome
257,8.0,--,Brandy Menefee,Brandy Menefee,"BraceFace Brandi is a sexy short comedy about a woman whose controversial combination of nudity and headgear sparks a media frenzy rivaled only by the obsession over whether Whitney Houston's crap sinks or floats. When the disarmingly candid covergirl finds her fifteen minutes carved up into scandalous soundbites, she's accused of every sin from worshipping Satan to h... Read all",42m,BraceFace Brandi
258,8.0,--,Amy Collins,Amy Collins,Add a plot,27m,American Icarus
259,6.9,--,Yoav Potash,Yoav Potash,Add a plot,--,Minute Matrimony
260,7.2,--,Jakub Sommer,Jakub Sommer,Minimalistic portait of a maximal love... Nothing is a cliche when it's happening to you...,21m,ELFilm
261,8.6,--,Dimitri Molimis,Dimitri Molimis,,12m,The Braindead
262,--,--,Rob Santana,Rob Santana,Very funny comedy short that deals with two misguided youths trying to fit into the urban world. Plenty of surprises arise and everyone is not who they appear to be.,25m,Frontin'
263,--,--,Dominic Green,Dominic Green,,15m,Day Trip
264,5.2,--,Ron Dyens,Ron Dyens,,4m,L'homme torche
265,6.9,--,Tsai Ming-liang,Tsai Ming-liang,A girl (Shiang-chyi Chen) looks for a street vendor in Taipei. But she can't find him since the Skywalk is Gone.,25m,The Skywalk Is Gone
266,6.6,--,David Bourla,Paul GreenbergSteve OedekerkVito Viscomi,The classic tale of the Godfather and his rule over the Mob as told by the loveable thumbs that we all can relate to.,32m,The Godthumb
267,7.7,--,Anuj Majumdar,Anuj Majumdar,"A whimsical tale about the domino effect of our actions, ""Equation"" revolves around a lonely astronomer who convinces himself that his neighbor is selling visas to illegal immigrants for sex/money. He decides to investigate bus his obsessive mission turns out to be as surprising as it is self-defeating.",16m,Equation
268,5.8,--,Gili Dolev,Gili Dolev,,15m,Promise Land
269,--,--,Sergio Sánchez Suárez,Andronico GonzalezEli Garcia RuizSergio Sánchez Suárez,"A young man who has been kidnapped tries to escape, but a contest call from a radio station is going to change his fortune.",10m,Barbados
270,--,--,Julie Puckrin,Julie Puckrin,,--,Ruthie's Door
271,--,--,Barry MacKinnon,Barry MacKinnon,,2m,Moose Hunter
272,8.3,--,Lisa Michele McTigue,Lisa Michele McTigue,Add a plot,3m,The Guy Next Door
273,--,--,Nathan S. Garfinkel,Nicolle Nattrass,"Trixie Veronica, the world's oldest living Brownie shares her views about being involved in one of the most powerful organized associations in existence.",6m,Brownie Points
274,6.4,--,Mark Whiting,August HallMark Whiting,"On the eve of Halloween, 1938, CBS radio reported UFO's in the skies over the United States. That same night, two notorious criminals escaped the maximum security prison at Macatawa... They were never seen again. Apple Jack is a high brow story about low brow people caught in a divine intervention.",16m,Apple Jack
275,7.5,--,Stephan Winkler,Moritz GerberStephan Winkler,,37m,GUF Ha-Neschamot - Die Halle der Seelen
276,7.1,--,Jim McKinney,Jim McKinney,"Ted Norwood summons all his resistance in order to finally quit his seemingly successful career, but first must face a powerful executive who barely even notices she's in a test of wills.",--,Fall Short
277,7.8,--,Kevin Fukunaga,Kevin FukunagaStevo Polyi,"The Making of the Dragon is a comedic satire (not a spoof) of the Kung-Fu film genre. Shot as a ""Behind-the-Scenes"" look at how a fictional Kung-Fu movie is made, the film is basically a movie about the making of a movie. The fictional film ""The Dragon"" tells the story of how a young boy, who's master is killed by a group of thugs, grows up to avenge his teacher's mur... Read all",13m,Four Fingers of the Dragon
278,5.9,--,Jesper Andersson,Stefan Ahnhem,,14m,Dieten
279,6.4,--,Matthias Kutschmann,Matthias Kutschmann,,23m,Solo ohne Ende
280,5.6,--,Phil Mulloy,--,Add a plot,3m,Cowboys: High Noon
281,6.4,--,Phil Mulloy,--,Add a plot,5m,The Ten Commandments Number 7: Thou Shalt Not Steal
282,4.4,--,Chema de la Peña,Óscar de Julián,Add a plot,17m,Lourdes de segunda mano
283,6.7,--,Phil Mulloy,--,Add a plot,5m,The Ten Commandments Number 3: Remember to Keep Holy the Sabbath Day
284,6.8,--,Phil Mulloy,--,Add a plot,5m,The Ten Commandments Number 9: Thou Shalt Not Covet Thy Neighbour's Goods
285,--,--,Greg Lawson,--,Middle part of a safe sex trilogy.,3m,Stop the Invasion
286,8.2,--,Matthew Ehlers,Matthew Ehlers,Add a plot,11m,The Alibi
287,6.6,--,Michael Burke,Michael Burke,Beneath a railroad bridge a young rural gay man begins to his explore his gay feelings with the aid of an understanding friend.,22m,Fishbelly White
288,5.8,--,Shona McCullagh,Shona McCullagh,"A black (and rather manly) nun bounces around on her bed while, next door, a white and feminine nun sleeps peacefully. After getting dressed, the two meet by chance in the ladies toilet where they find all the stalls to be engaged. Their physical competition to be next in the queue starts confined to the ladies but quickly spills out onto a train and an open field whe... Read all",5m,Hurtle
289,6.5,--,C. Jay Cox,C. Jay Cox,,5m,Reason Thirteen
290,6.3,--,--,--,--,19m,Twitch
291,7.2,--,Christoph BrunnerSteffen JürgensStefan Lampadius,Christoph BrunnerSteffen JürgensStefan Lampadius,Add a plot,7m,Das Leben des C. Brunner
292,7.9,--,Christoph Heckenbücker,Marcel-Kyrill GardelliChristoph Heckenbücker,"The childlike Newman sets an ingenious trap for his domineering brother Ringo, in an attempt to get ""quits"" following 15 years of fraternal oppression.",10m,Quits
293,5.3,--,David Sukup,David Sukup,,9m,Mechanika
294,7.9,67%,Wayne McClammyJoshua J. Smith,Wayne McClammyJoshua J. Smith,"Ms. Pac Man fever runs rampant in this Eighties, teen, roller skating comedy that chronicles Bobby Chang's battle for lust or love of the most popular girl in school. Drop a quarter in and experience Triple Threat!",23m,Triple Threat
295,--,--,A.F. Grant,Sue GardnerAlyson Ridlon,,20m,We've Got Johnny
296,--,--,Craig Knitt,Craig Knitt,A man mowing his lawn tries to maintain a positive attitude but his inner thoughts reveal how difficult it is for him.,4m,Lawnboy
297,8.2,--,Farid Dms Debah,Farid Dms Debah,"Christophe Valet is a young film director budding with hopes and dreams. His imagination carries him into a fantasy world of limitless and abundant success. Unfortunately, reality is something far removed. In order to make his first film, he must succumb to the demands of the producers. Christophe thinks he has found an ideal partner in the distinguished European film... Read all",11m,Art'n Acte Production
298,6.3,42%,Angela Robinson,Angela Robinson,A quartet of girls from a prep high school are recruited by a secret paramilitary academy to conduct cloak-and-dagger missions.,11m,D.E.B.S.
299,6.4,--,Michele Andina,Michele Andina,A young photo-lab assistant falls in love with a guy in a picture he develops.,16m,Fotostar
300,8.7,--,Brian Fischer,Brian Fischer,The story of a boy... his time portal... and the plastic lobster he loved.,8m,L'histoire de Billy Matter
301,6.3,--,Alan Lau,Warren GraffAlan LauRhode Montijo,"In this animated short by the creators of Happy Tree Friends Buddhist Monkey, a monkey who is very peaceful and relaxed, is meditating in the garden when all of the sudden he get's attacked by three green ninjas who damage the beautiful plants in his garden, including one flower that he loved the most, which causes him to get angry and show his amazing martial arts sk... Read all",3m,Buddhist Monkey
302,--,45%,Ruy Portillo,Frederick LankauAna Cláudia Vaz,,2m,The Proposal
303,7.0,--,Patricio Serna,Patricio Serna,Add a plot,3m,Llamada de apareamiento
304,6.4,--,Adam Baran,Adam Baran,A talkative man finds Mr. Right in the men's room.,8m,Love and Deaf
305,7.0,--,Lewis Martin Soucy,Lewis Martin Soucy,A woman invites a man for one last drink at her place...,8m,Handicap
306,7.4,--,Martin McDonagh,Martin McDonagh,"A black and bloody Irish comedy about a sad train journey where an older man, whose wife has died that morning, encounters a strange and possibly psychotic young oddball....",27m,Six Shooter
307,7.5,--,Camille Cellucci,Jacquie BarnbrookCamille Cellucci,"When a 30-ish overweight frump is pressured by her overbearing, plotting Mother to get her act together and get a man, she agrees to one last blind date and takes matters into her own wardrobe.",18m,Wear Something Nice
308,6.5,--,Rich Ho,Rich HoKatharine Chong,"After decades of watching aliens wreak havoc in America, ""The Alien Invasion"" brings the absurd battle to the comical side of Singapore. After seven thousand earth years, they have returned to harvest their newly grown planet of slaves. Discover how a glitch in alien technology allowed a small university, in a small country, to help save the world. Featuring Singapore... Read all",18m,The Alien Invasion
309,7.9,--,Stephen Papadimitriou,Mike AndersonStephen Papadimitriou,,--,The Power of the Chip
310,--,--,Ford Austin,Ford AustinJed Rowen,,--,A Cerebral Print Halloween Special
311,--,--,Ford Austin,Ford Austin,,--,Brothuh of Cerebral Print
312,--,74%,Margo Romero,Edward E. Romero,"What happens when an unemployed actor robs a coffee house filled with a smart ass writer, a wannna-be action star and a barista who produces the coffee?",10m,Headshot
313,6.7,--,Michael Caradonna,Michael CaradonnaSean ChristopherBrian Wright,Add a plot,17m,Study Hall
314,--,--,Gary E. Irwin,David BrothersMatt CasaleTroy Hill,Eventide Productions & Tromatickill Pictures team up to bring you a frightening look at the classic monster in modern day.,5m,Things That Go Bump in the Night
315,7.7,--,Xtian Bretz,Xtian BretzBrennan Reed,"""how to be: emo"" is a funny, inventive and fresh short film from the minds of Chris Bretz and Brennan Reed. The story is fairly simple -- a typical Everyboy named Billy wants to learn how to 'get all the girls,' just like Kyle, the school's resident emo kid. Of course, every teen can use a little helping hand, and so Billy is walked through the how-to's of emo by the ... Read all",21m,How to Be: Emo
316,--,82%,Chris GreybeThom Greybe,Chris GreybeThom Greybe,Add a plot,12m,Boxing Day
317,8.0,--,Hervé Pichard,Hervé Pichard,"How charming this young lady is, the two friends think when they first meet her. And her being Japanese makes her even more exotic and attractive to them. Unfortunately this is her last day in Paris before returning to Tokyo. But tomorrow is another day and the two friends decide to accompany her across the city of lights. Will they see her again once her plane has ta... Read all",17m,Dernier jour à Paris
318,--,--,Oliver Kahl,Oliver Kahl,,9m,Boris the Diamond Catcher
319,--,--,Kevin Blake,Kevin Blake,,5m,The Adventures of Mapboy II: Caution Speedbumps Ahead
320,6.4,38%,Jon Bang Carlsen,Jon Bang Carlsen,"A lonely sheep farmer in his fifties employs the services of a matchmaker to find a wife. Out in his small country farm-house in the super green fields of Ireland with his dog ""Rowd,"" he makes up his mind and spruces up his life for new love.",44m,It's Now or Never
321,--,--,Matt Orefice,Matt OreficeEdouard Williamson,"A recluse attempts a blind date with a serial killer, set up by his morbidly obese mother.",30m,Rendez-vous à Rennes
322,6.7,--,Arthur de Pins,Arthur de Pins,Gerard is dealing with an unwanted sex change.,9m,Géraldine
323,6.1,--,Noah Baumbach,Noah BaumbachCarlos JacottJohn Lehr,"When Conrad and Butler decide to take a vacation, things don't go quite as planned.",30m,Conrad & Butler Take a Vacation
324,8.6,--,Yves Courbet,Yves Courbet,"On a desk in disorder, a small very excited fire cracker abuses a pair of scissors and a match box. Under the fire cracker named Schpack's intolerable excitement, Cuty the scissors and Matchbox decide to fight together to get rid of this unbearable intruder. But they do not know how crafty Schpack is.",3m,The Firecracker
325,8.4,--,Yves Courbet,Yves Courbet,"In a quiet and green park a nice baby is sleeping peacefully, in his stroller. Suddenly he is disturbed by the arrival of an unbearable sparrow who keeps on whistling. Exhausted by this unceasing and stressing song, the baby decides to react. An unusual duel begins between the child and the bird.",3m,Flying Baby
326,8.1,--,Andy Bobrow,Andy Bobrow,"The suppressed history of America's Black space program, in mockumentary form broadly satirizing Ken Burns and histories of the Negro Baseball Leagues.",10m,The Old Negro Space Program
327,5.6,--,Michael Caradonna,Michael Caradonna,,4m,Sick Call
328,6.1,--,Jamie BradshawAleksandr Dulerayn,Jamie BradshawAleksandr Dulerayn,"Hannah Marker, Deputy Director of the American humanitarian aid organization, U.S.AID, has a serious problem. She is addicted to the sight of money. Her doctor tells her the problem stems from her confusion of concrete and real money. Whenever she sees an American dollar she envisions the true ideal of money, absolute happiness, and is thus transfixed. Afflicted. Beca... Read all",15m,The Offshore Reserves
329,--,--,David Logan,David Logan,"Eddie Green hates his life. He hates his job, he hates his wife, his hates his home, everything. When Eddie reaches the end of his tether and decides to end it all, he has a vision of Pinocchio. Pinocchio tells him that the way to escape his miserable existence is not to kill himself but to cut himself into little pieces and mail himself away limb by limb, replacing w... Read all",21m,Male Mail
330,--,--,Jonathan Katzeff,Jonathan Katzeff,Add a plot,10m,Flickpingis
331,--,--,Rubén Rodríguez,--,,--,Cambio de marcha
332,7.0,--,SuperYoshi,David EhrmanSean RocheSuperYoshi,"A video re-mix of Recycled Koopa (1990), widely recognized as the first ever ""YouTube Poop"".",3m,I'd Say He's Hot on Our Tail
333,8.2,--,Grégory Morin,David Neiss,Add a plot,6m,Dernier cri
334,8.7,--,Jonathan Avigdori,Jonathan Avigdori,"A story about a dysfunctional Jewish family in Brooklyn. Shula and David have two sons: Nick, an alcoholic, marriage consultant who's watching his own marriage collapse and Ben, (in the closet) who's having problems with his transvestite partner, Jasmine. Not aware of Ben's sexuality, the parents decide to fix him up with a nice Jewish girl on Passover night. The supp... Read all",32m,Jew Tales
335,6.8,--,Mad Martian,Mad Martian,"A broccoli farmer whose own children hate broccoli invents a plant hybridization device in an attempt to make broccoli taste better so kids will eat it. On the verge of success, he has a terrible accident that will forever change his life. You will never look at broccoli the same again!",--,The Inedible Bulk
336,6.6,--,Elio Quiroga,Stephen KingElio Quiroga,An animated horror zombie-comedy about domestic violence.,11m,Home delivery: Servicio a domicilio
337,7.6,88%,Mark AndrewsAndrew Jimenez,Andrew JimenezMark Andrews,Two buskers engage in a petty feud over a child's donation.,4m,One Man Band
338,7.3,--,Rick Alyea,Rick Alyea,What has your life been like without Hockey?,14m,Puck This
339,6.2,--,Joseph BarberaSpike Brandt,William HannaJoseph Barbera,"Tom and Jerry cartoon short directed by Joseph Barbera and Spike Brandt. It was the last Tom and Jerry cartoon to be written, co-storyboarded, co-directed and co-produced by the characters' co-creator Joseph Barbera.",8m,The Karate Guard
340,6.5,--,Edgar Wright,Edgar Wright,This home movie features a cop named Barry Stern who has to hunt down a serial killer. In the style of Dirty Harry meets Airplane.,39m,Dead Right
341,7.0,--,Hal Hartley,Patricia DunnockParker PoseyAdrienne Shelly,"Two charming but inept agents of the supernatural (sort of like cupid goddesses) decide to interfere in human affairs. Mini Musical Comedy. Like one of those Shakespeare situation comedies in the woods. Or the Beatles ""Magical Mystery Tour."" A mini-opera with some sort of dense but ultimately meaningless plot. There's a young man who works too much and who needs to fa... Read all",8m,Opera No. 1
342,7.3,97%,Phil Mulloy,Joel Cutrara,"While out eradicating space debris, a strange object is discovered and brought back to Earth. The consequences are disastrous.",11m,Intolerance
343,7.5,--,Alyson Shelton,Alyson Shelton,"After getting out of a bad relationship, Jillian decides to mend her heart with a quest. She goes in search of the perfect f***, but discovers it's harder than she thought to put her heart on hold.",12m,In Search of...
344,6.8,--,Ian Fischer,Ian FischerF. Paul Wilson,Pro-life house wife falls in love with the latest trend to hit New York City: handbags made out of fetal skin.,15m,Foet
345,6.9,--,Phil Mulloy,Phil Mulloy,"Once upon a time there was a war between earth and the planet Zog. The two vast space fleets took off to do battle but, at the point of contact in deep space, the earth crews were smelling their girlfriend's underpants while the Zog's were distracted watching porn # and so they passed one another. 30 years later the Zog have invaded earth unnoticed. One man, Dwight Ho... Read all",15m,Intolerance II: The Invasion
346,--,--,--,--,--,12m,Run!
347,--,--,Nathan ShieldsJeromey Shannon,Jeromey ShannonNathan Shields,Add a plot,--,Five by Ten
348,--,--,Jesús Marugán,George LucasJesús Marugán,,11m,Star Wars: Episodio Pi - Sithspotting
349,--,--,M.C. Griffin,M.C. Griffin,,8m,Happy Homicidal
350,7.7,--,Peter Cornwell,Mark BradridgePeter CornwellAndrea Del Bosco,"Ben, our main character, wakes up in an unusual hospital after seemingly landing on an asphalt road due to a car collision. He later wakes up to the sound of dog barking and decides to explore the hospital. After he studies the hospital, noticing all the details from the plain white hallways from the surgical tools spread about the rooms, he realizes this isn't a norm... Read all",15m,Ward 13
