,IMDB,RT,Direccion,Guión,Argumento,Duración,Título
115,6.5,--,Chuck Jones,Don ArioliStephen FossattiStan Freberg,Michigan J. Frog is shown to have caused problems throughout history to those greedy souls who try to exploit him.,9m,Another Froggy Evening
116,5.1,--,Illeana Douglas,Illeana Douglas,"Celena and Charlie live together in L.A., and both of them want to make it in the movies. At a Hollywood party, Charlie manages to grab himself a part in a film, and he does it by stealing material from Celena. Then he discards her, like a used tissue. Not only does she get mad, she gets even.",21m,"Boy Crazy, Girl Crazier"
117,6.6,--,Fernando Fragata,Fernando Fragata,Add a plot,22m,Amor & Alquimia
118,7.1,75%,Douglas McCarthy,Tim CahillJulie McNally Cahill,"A spoof of the classic film Casablanca (1942), starring Warner Bros.' Looney Tunes characters.",8m,Carrotblanca
119,7.3,--,Chris Bailey,Tim Hauser,"In an attempt to convince Minnie that he hasn't forgotten to buy her an anniversary present, Mickey Mouse ends up promising to take her to Hawaii. Funds being short, he applies for a job as lab assistant to the sinister Dr. Frankenollie, who happens to be searching for a donor to provide his monstrous creation with a brain...",7m,Runaway Brain
120,5.4,--,Susan Seidelman,Jonathan BrettSusan Seidelman,Teresa is not like her female colleagues. She cannot enjoy that kind of simple minded pleasure like watching males stripping. There is that Dutch painting in the museum she is fascinated of. Over and over she sits in front of it just staring at the young Dutch guy on it. One day the scenery on the painting becomes alive...,28m,The Dutch Master
121,9.4,--,Dmitri Frolov,Dmitri Frolov,This film tell us about intricate attitudes in male collectives on navy. The film bore in poetical form with respect for differently minded heroes.,20m,Shatanger Aylok
122,7.1,--,Michael Dudok de Wit,Michael Dudok de Wit,"A plump and exuberant monk goes fishing, and a playful fish eludes him. First the monk uses a rod and reel, then a net; over and over, he ends up fish-less and wet. Sleepless, he tries luring the fish at night with a bank of candles. He tries a bow and arrow. The tireless and insouciant fish leads the monk through a viaduct, over irrigated steppes, across cisterns, do... Read all",6m,The Monk and the Fish
123,6.5,--,Javier Fesser,Javier Fesser,Add a plot,15m,Aquel ritmillo
124,7.2,--,Javier Fesser,Javier Fesser,"On the run from the police in a desperate attempt to escape a pair of Civil Guardians, a peaceful gas-station worker embarks on a frenzied road adventure.",17m,The Seclet of the Tlumpet!
125,6.5,20%,Bill Plympton,Bill Plympton,"An animated look at the 11 essential steps to make the pilgrim's progess from finding a woman to making love to her. Along the way, our prototypical man gets advice about her eyes, her hair, her neck, her nostrils (and how they will flare as she becomes excited), the kiss, disrobing her (be subtle yet have authority), the hug, her nipples, and kinky accessories. At ev... Read all",5m,How to Make Love to a Woman
126,6.5,--,Douglas Aberle,Douglas Aberle,"Fluffy really needs to go for a walk, but finds that his master just isn't getting the hints.",5m,Fluffy
127,7.7,--,John Dilworth,John Dilworth,"In this pilot for Courage the Cowardly Dog (1999), Courage, the cowardly dog of an oblivious elderly couple that lives on a remote farm, must defend them from a malicious space chicken bent on conquest and its mutagenic eggs.",8m,The Chicken from Outer Space
128,--,--,Christopher Grimm,David FuhrerChristopher Grimm,"On assignment for public access TV, a documentary crew has one day to locate the elusive Dubinsky, a legend of New York's Lower East Side. Acting on a tip from a deranged homeless man, the crew runs into Dubinsky's mailman, Dubinsky's auto mechanic, Dubinsky's tailor - even Dubinsky's main squeeze - but no Dubinsky. How could one slow-moving geriatric manage to evade ... Read all",--,Looking for Dubinsky
129,7.7,--,Damien O'Donnell,Damien O'Donnell,"Philip is a misfit at his new school. When he is bullied, his mother decides to sort out things between him and his schoolmates, because his father unable to do so, as he is currently doing time in prison.",27m,35 Aside
130,6.5,--,Margarida Cardoso,Margarida Cardoso,,15m,Dois Dragões
131,5.8,--,Douglas McCarthy,Mark EadesRyan A. HarmonKathleen Helppie-Shipley,"Marvin the Martian mistakes Daffy Duck's Duck Dodgers show, in which Dodgers announces that his forces are about to invade Mars, for a live broadcast and retaliates by going after Daffy, who still thinks they're shooting the show.",12m,Marvin the Martian in the Third Dimension
132,7.7,--,Jeff Fisher,Cormac WibberleyMarianne Wibberley,"When Julia thinks her boyfriend Brent is cheating on her, she sells all his designer clothes in a garage sale.",30m,Garage Sale
133,7.1,--,Juan Carlos Fresnadillo,Fredric BrownJuan Carlos FresnadilloJesús Olmo,"Antonio and Concha, a couple who are constantly fighting about money, win the Christmas Lottery first prize. Concha, who is very bossy, starts making decisions about how they're going to spend it. But Antonio is fed up with her, he just wants to go to Brazil, lay in the sun, and never see her again. So he starts to plan how to get rid of her...",24m,Esposados
134,4.0,--,Júlio Alves,Wilson Siqueira,"On a supermarket shelf, a particular alarm clock keeps blaring off-hand, upsetting the staff and the customers. Eventually, it's golden frame attracts the attention of a shoplifter, who is almost caught by security because of that feature. After escaping without paying from two other stores, the thief will come face to face with a cop - also wearing a long coat simila... Read all",--,O Despertador
135,--,--,Júlio Alves,João NatividadeJosé BarahonaJúlio Alves,Add a plot,12m,A Fachada
136,7.2,--,Daniel Gruener,Lisa Owen,"Luis (García) is attempting suicide from the top level of a construction building when he is interrupted by Don Ramón (Ruiz) who also wants to kill himself. The two men engage into a conversation about life, love and family while sharing a song: ""De jazmín en flor"".",13m,De jazmín en flor
137,--,--,Ángel Martínez Astudillo,José Manuel Martín,,7m,El pisito
138,--,--,Carolynne Hew,Carolynne Hew,,8m,Bangs
139,--,--,Murphy Dunne,Murphy Dunne,A satire about a sleazy Roman attorney torn between defending Jesus or Barabbas in AD 33.,11m,The Lawyer
140,--,--,Franck Salomé,Franck Salomé,Add a plot,6m,"Bien le bonjour, Monsieur Georges!"
141,6.8,--,Fatih Akin,Fatih Akin,Two Turks from Germany find each other in their homeland during summer holidays and their need for weed start a funny little adventure. A pretty smart idea that comes from a Turk solves the problem: getürkt.,12m,Getürkt
142,7.0,--,Graham Higgins,Graham Higgins,"A young man fools his parents into thinking he's a merchant banker while working as a lavatory attendant. The story of a young school leaver and his bizarre scheme to win his parents' approval. Set in the home city of Writer / Director Graham Higgins, Pride is a comic look at the grand ambitions of youth and the dour wisdom of age.",10m,Pride
143,--,--,Rafael Straga,Alberto Ferreras,,15m,Tómbola
144,--,--,Daniele FalleriWerther Germondari,Daniele FalleriWerther Germondari,"Single woman turns out to be pregnant. By whom? A young woman is the only lonely soul in a small town where everyone seems to have a partner. One day her belly starts to grow, but no one has ever seen her with a man. Five long seasons pass and she gets bigger and bigger.",12m,L'armadio
145,7.5,--,Fernando Javier León Rodríguez,Fernando Javier León Rodríguez,"Husband and wife are seated in their living room. Everything is quiet. She's knitting, he's reading the paper. Suddenly, she breaks the silence.",3m,La tarde de un matrimonio de clase media
146,7.5,--,John Curran,John Curran,"An anthromorphic tale, humans representing canines, of compulsive traits and raging desires. A gang of neutered men; fat, subdued and lazy, look out for their younger 'pup'- Rusty who is always active and mischievous.",15m,Down Rusty Down
147,7.5,--,Jamie Neese,Jamie Neese,,--,A La Cart
148,7.1,--,David L. Bertman,David L. Bertman,"When college freshman, Brinton Smith discovers a business card with the number 976-WISH inscribed in silver, he is instantly hooked up with Wish Services, an ultra modernized corporation of unionized Toothfaires, Santa's Helpers and Genies. Assigning a Genie Third Class to his case, the Corporation is unable to grant even the simplest of wishes. Brinton discovers the ... Read all",42m,976-WISH
149,6.7,--,Chris Deacon,Brigitte GallErin McMurtryDale Power,"Sue is trying to get over a break-up with Dale. She goes out to get coffee in her nightgown and meets him and his new girlfriend, Sabrina, in the convenience store. Mortified she leaves and finally accepts an invitation from a lesbian friend to go to an all-girl bar that night. She's surprised to see Sabrina there dancing with women. They begin to talk, dance, and end... Read all",15m,Twisted Sheets
150,5.8,--,Sanjin Frlan,Sanjin Frlan,,--,Children of the 80's
151,--,--,Lara Harris,David CarlsonLara Harris,,10m,9 1/2 Minutes
152,5.9,--,Chuck Jones,Stephen Fossatti,"When pirate Yosemite Sam discovers Bugs Bunny's treasure chest, the rabbit, unwilling to part with his riches, pursues Sam aboard his ship and proceeds to pester the pirate until he pleads for mercy.",7m,From Hare to Eternity
153,7.3,--,Tim Hill,Tim Hill,The Action League is up to their greatest challenge yet when a giant baby attacks the band KISS during one of their concerts.,5m,Action League Now!!: Rock-A-Big-Baby
154,6.4,--,Stephen Fossatti,Stephen Fossatti,"Sylvester's parental instincts kick in when his newly-hatched breakfast calls him ""Mama"".",9m,Father of the Bird
155,7.8,--,Robert Sarkies,Robert Sarkies,"It's the late 1950s, and the DJ of a nostalgic radio program, out-of-date in the time of the Beatles, has just been fired. On his last broadcast, he decides to play requests, and a loyal listener (according to his ratings, just about his only listener) asks for her late husband's favorite song. But when fate intervenes, the DJ has to prove just how far he'll go to mak... Read all",15m,Signing Off
156,--,--,Monica Nolan,--,,8m,World of Women
157,6.4,--,Konrad Jay,Colin Bateman,"It's Christmas, and in a Belfast toyshop, three despairing people are forced to contemplate suicide on a dangerous window ledge; a recently fired dad who has only enough money to buy his daughter a giant teddy bear, an alcoholic Santa who's fed up with kids, and the bankrupted store owner. When two security guards attempt to talk them down, they end up on the ledge as... Read all",18m,Jumpers
158,6.8,--,David Kaplan,David Kaplan,A black comedy version of the classic tale.,12m,Little Red Riding Hood
159,6.2,--,Darrell Van Citters,Stephen FossattiDarrell Van CittersDean Wellins,"Pete Puma is trying to raid the henhouse Foghorn Leghorn is guarding; Foggy decides to have some fun with Pete. He tells Pete what he really wants is a Venezuelan Racing Chicken which has unfortunately run back to Venezuela. Pete runs there and back in jig time. Next, he really wants an Irish Wrestling Chicken, which turns out to be a rope tied to a bull's tail. When ... Read all",7m,Pullet Surprise
160,7.0,--,Tom KokenBarbara LippTom Rubnitz,Tom KokenBarbara Lipp,"A special tribute to all the mothers in the world. A woman recollects her childhood memories with her mother, remembering all the questions and doubts she had when she was little, from innocent questions to more challenging ones, later on evolving to a homage to her .",4m,The Mother Show
161,7.0,--,David FineAlison Snowden,Alison SnowdenDavid Fine,"A devoted and happily-married housewife organises a surprise party on the occasion of her husband's birthday, unbeknownst to her that her dentist spouse is experiencing a sudden mid-life crisis at his office.",12m,Bob's Birthday
162,8.1,100%,Nick Park,Bob BakerNick Park,Wallace's whirlwind romance with the owner of the local wool shop puts his head in a spin; Gromit is framed for sheep-rustling in a fiendish criminal plot.,30m,A Close Shave
163,6.7,92%,Edwin Baker,Steve Monroe,A black comedy about a lapsed catholic who picks the wrong priest for Confession.,20m,The Confession
164,7.8,--,Sylvain Chomet,Sylvain ChometDavid FreedmanAlan Gilbey,"In seductive central Paris, an undernourished gendarme willing to go to great lengths to feed himself hatches a desperate, yet utterly cunning plan.",21m,La vieille dame et les pigeons
165,6.6,--,Sheryl Lee Ralph,Sheryl Lee Ralph,,13m,Secrets
166,8.3,--,Carlos García Campillo,Carlos García CampilloSalvador Vazquez Martinez,"It was just another day at work for Ramon T. and El Rey, two hitmen who worked for Don Bubu. Their job was simple: beat the heck out of Betus, who just got Don Bubu's daughter pregnant. Neither of them could have imagined what faith had in store for them.",13m,Un chorrito de sangre
167,7.3,--,Miles Hood Swarthout,Glendon SwarthoutMiles Hood Swarthout,"Dottie and Madge are friends that share something in common... they are both widows of golfers. When they get together at their country club, they're other girlfriend can't make it. Dottie and Madge order martinis. Madge tells Dottie that they have to get drunk to be brave. Dottie doesn't understand what she means but still keeps ordering the drinks. After Dottie unin... Read all",23m,Mulligans!
168,6.5,--,René CastilloAntonio Urrutia,René CastilloAntonio Urrutia,"One night in the city. A man attempts to commit suicide from the upper level of a tall building. His action is closely watched by a cowboy and a pin-up girl, both characters on two billboards over the neighbouring buildings.",4m,Sin sostén
169,--,--,Anne Chapman,Anne Chapman,"A clumsy businessman is made fun of by the neighborhood children because he rides his bicycle to work every day. One morning, he falls off his bike and decides not to get up, figuring he is no use to anyone...",--,The Cycle of Love
170,5.0,--,Daniel HaalandRune J. Keller,Rune J. Keller,,28m,Mørkeræd
171,6.6,--,Martin Arnold,Martin Arnold,"Mickey Rooney and Judy Garland perform a hellish courtship in a nightmare of the American dream, created by manipulating old film.",15m,Alone. Life Wastes Andy Hardy
172,6.5,--,Grant Heslov,Grant Heslov,An unlucky actor named Josh Silver is hopeful when his agent gets him an audition with his idol Woody Allen.,30m,Waiting for Woody
173,7.0,--,John McKay,Vicki MassonColin McCredieRalph Riach,"In a little Scottish town by the sea, the rain pours and the wind howls and the people are just as miserable as their weather; even Reverend Archie, the trainee minister, is hard pressed to be cheerful. And then, one day, his prayers are answered. The town basks under a Mediterranean heatwave; and all of a sudden folk are eating alfresco and going ballooning and havin... Read all",13m,Doom and Gloom
174,--,--,Andrew Levy,--,,--,Simple As a Dog
175,7.1,--,Lynn-Maree Danzey,Judi McCrossin,"A first date: he shows up at her flat, several stories up in her building. She's finishing getting ready, so she introduces him to her dog, which loves to fetch a small red rubber ball with blue stars. He tosses the ball to the dog a few times, somewhat distractedly, looks through a book (""Do I have to be me?"") on her coffee table, opens the French doors to her balcon... Read all",7m,Fetch
176,7.9,--,Arish Fyzee,Michael Jeter,"The mythical city of Atlantis has risen from the depths in The Forum Shops at Caesars Palace, and champions are being called from around the empire to Race for Atlantis, the world's first giant-screen Imax 3-D ride. The effect created is an unbelievable chariot race through the streets of Atlantis, where the diabolical Ghastlius will stop at nothing to win.",4m,Race for Atlantis
177,5.7,--,Sylvie Rosenthal,Sylvie Rosenthal,"A renowned chef (Pascale Montpetit) who has created a succulent dessert, the Chocolate Bomb, suffers from information bulimia.",16m,La bombe au chocolat
178,7.4,--,Béla Somhegyi,Béla Somhegyi,,30m,A tanévzáró
179,7.4,--,Enda Hughes,Mik DuffyEnda Hughes,"Northern Ireland Sci-Fi comedy, made in the style of a 1950s B-movie.",12m,Flying Saucer Rock'n'Roll
180,8.3,--,Eric Fleming,Warren Davis IIEric Fleming,,--,Fallen Arches
181,6.4,--,John Henry Richardson,John Henry Richardson,"A gang of modern-day bank robbers (the Johnny Hill Gang) who pattern their robberies after the exploits of the notorious John Dillinger. When the gang discovers that the legendary outlaw-who was reported to have been gunned down by the FBI in 1934-is still alive, they go on a cross country quest to find the real Dillinger...",25m,Dillinger in Paradise
182,7.6,--,Keith Thomson,Keith Thomson,,9m,Cupidity
183,5.4,73%,Ben StassenSean MacLeod Phillips,Ben StassenKurt Frey,"A lab accident sends a scientist and his robot assistant on a trip through the history of 3D film. Special appearance by horror host Elvira, Mistress of the Dark.",40m,Encounter in the Third Dimension
184,8.6,--,Ron Sparks,Ron Sparks,"Robin moves into her seemingly perfect new apartment, but soon realizes she can't get her overly-helpful new neighbour Dwight to leave her alone.",19m,Robin's Nest
185,--,--,--,--,--,11m,Meal Ticket
186,6.3,84%,Beverly Chase,Beverly Chase,Two college guys first ponder and then accomplish their goal of buying an old postal jeep.,14m,Going Postal
187,5.7,--,Vin Vuyen,Vin Vuyen,A bizarre super hero in tights tries to retrieve Quentin Tarentino's briefcase from a thief.,7m,Let's Get Real!
188,5.4,--,Mike L. TaylorJesse Witten,Mike L. Taylor,"""Apocalypse Now"" meets ""Clerks"" in this story of a man who is sent in to close a video store and terminate the command of its rogue manager.",21m,Clerks of Darkness
189,7.2,--,Britta Krause,Frank Knauer,,7m,Fünf Minuten
190,6.4,88%,Daniel Wilson,Jeanne Marie Spicuzza,"Naked is a journey through history, intellect, passion and art, a culmination of ten years of work written and directed by Jeanne Marie Spicuzza.",40m,Naked
191,7.5,--,David Graham,David GrahamStephanie Urdang,,--,Crash & Burn
192,3.0,--,Tony Papa,Sharon GibbonLiz Rosch,"When Marilyn neglected to phone her old boyfriend Eric for five years, there was no harm intended - she was just really busy. And now he's come to visit, and he won't leave. As errands and annoying little tasks, like last year's tax return, pile up, Marilyn copes the only way she knows how - by putting things off. Things like asking him to leave. But when Eric suddenl... Read all",23m,Does That Make Me a Bad Person?
193,6.5,--,Jamie Babbit,Jamie Babbit,A lesbian mom tells her daughter of how her mommies met through the retelling of the Sleeping Beauty fairytale with 2 lesbian leads and no Prince Charming.,13m,Sleeping Beauties
194,6.3,--,Mark Baker,--,"After marauding and sinking another ship, a band of pirates capture a female passenger, then send her overboard as punishment for her defiance. She vows revenge, and fortunately is rescued by a small passing ship carrying only its captain, his first mate and a cat. They cross paths with the pirates, but both sides - after seeming to have victory within their grasp - m... Read all",12m,Jolly Roger
195,7.6,--,Tony AnselmoDiane Michelle,--,Donald and Daisy are enjoying a relaxing night at the opera when Donald reaches into Daisy's purse and pulls out a bomb! Now he must defuse it without Daisy noticing.,2m,Mouseworks Opera Box
196,6.1,100%,Tiago GuedesFrederico Serra,Rodrigo Guedes de CarvalhoTiago GuedesFrederico Serra,"After a sink full of soapy water empties through a gurgling drain, a finger appears from underneath: Zé, a plumber, is at work. Eva, the lady of the house, interrupts him wearing little but a smile. She coaxes him out and seduction begins, interrupted by the surprise arrival of her lover, Carlão, a gun-toting criminal. Zé hides under the sink, watching through the dra... Read all",16m,Sink
197,5.0,--,Rosa von Praunheim,Lawrence ElbertRosa von Praunheim,"Jeff Stryker from the Midwest arrives in Hollywood, rents a motel room, and becomes the major fantasy of the owner, his mother, and all the other guests. Young and old, male and female, black and white: everybody finds him delectable. In the end, they invite him to Christmas dinner.",30m,"Can I Be Your Bratwurst, Please?"
198,6.7,--,Peter Peake,Peter Peake,"Two very bored shadowy characters try to think of something to do--and end up playing ""Shadow Puppets.""",7m,Humdrum
199,7.0,--,Jay Lowi,Jay Lowi,"Billy's just been fired & evicted, and someone's trying to bury him alive. Jenny's boyfriend has drugged her and stolen everything. When they meet, things go downhill.",18m,12 Stops on the Road to Nowhere
200,6.8,--,Bill Plympton,Maureen McElheronBill PlymptonP.C. Vey,It's the little things that really hurt.,6m,Push Comes to Shove
201,6.6,--,Bill Plympton,Bill Plympton,A man plucks a hair from his nostril. The hair wants back in.,7m,Nose Hair
202,5.1,--,James Gunn,James Gunn,"Public Service Announcement meant only for mother hamsters, warning them against eating their progeny due to the harmful effects it has on the human children who love them. We see one young child, Billy, who commits suicide after he witnesses the gory tragedy of his hamster, Princess, eating her babies. All of this is narrated by a large-busted Tromette in a bikini, S... Read all",3m,Hamster PSA
203,--,--,Adonis FloridisTheodoros Nikolaidis,Theodoros NikolaidisAdonis Floridis,,26m,Espresso
204,7.1,--,Marek DobesStepán Kopriva,Marek DobesStepán KoprivaJirí Pavlovský,"Pavel and Eva are two teenagers who live a happy life full of McDonald's food, action movies and pop music. But one night, Pavel stumbles upon a secret gathering of intellectuals in the woods on his way to the video store. Not wanting to be discovered, the intellectuals attack him and the chief intellectual bites him in the leg. Some times later, he begins changing...... Read all",16m,I Was a Teenage Intellectual (Byl jsem mladistvým intelektuálem)
205,6.4,--,Bill Plympton,Bill Plympton,A mischievious man plays an assortment of extreme practical jokes on unsuspecting victims - like replacing one man's razor with a chainsaw.,7m,Surprise Cinema
206,8.8,--,Patrick Hogan,Patrick Hogan,"Whitney's dream of meeting the perfect man is turning into a nightmare. Then, in an unexpected moment, she meets him and gets his business card. But a strong gust of wind blows the business card out of her hands and leads Whitney on a comical, slapstick quest to recapture the card and find the man of her dreams. But in the end, she discovers that sometimes what you're... Read all",12m,The Business Card
207,--,50%,Joe AlterJoe Alter,Grant Moran,Couple of Jersey garbage men chit-chatting while they make their rounds. Experimental CG Short.,--,Jersey
208,--,43%,Steen Agro,Steen Agro,"Gary turns up at Alison's door claiming she is his mother but they're the same age so it's impossible, isn't it?",13m,Mother's Day
209,5.0,--,Steven L. Austin,Josh Olson,"""Bill"" is a gung-ho advertising executive with too much power and too few people skills. We find him working on a campaign for a soothing vacation package, but his life is quite the opposite: a constant barrage of mobile phone calls, pages and faxes. One evening, as Bill wraps up the deal (while simultaneously listening to a CD, his answering machine messages, and wat... Read all",15m,A Moment of Silence
210,--,67%,Thomas Gill,Matt Jennings,"A young man named Milton has just received a package in the mail, but he can't see it because an annoying redneck named Mudd won't leave him alone.",--,The Package
211,9.3,43%,Philip Pucci,Chris HumePhilip Pucci,We follow a movie extra's performances in several films.,--,The Extra
212,7.7,--,Jennifer Phang,Jeff KirschenbaumJennifer Phang,"When a gay asian brother and sister decide to ""come out"" at dinner on the very same night the unexpected happens.",24m,"Love, Ltd."
213,6.2,--,Grant Barbeito,Grant Barbeito,A man prepares his suicide up to the point of perfection.,6m,Ruben
214,6.6,--,Imogen Murphy,Imogen Murphy,"Marty is very short; but he's neither nasty nor brutish, he's a genuinely nice guy, rich in friends but solitary in the game of love. Women, as he says, are over his head; he's out of their picture. Then, he meets Alison, and on a hike up a fairly steep mountain, he shows his down-to-earth courtesy, and she notices his eyes. Life, like Marty, is short. Has he met his ... Read all",10m,Short
215,7.5,--,Taz Goldstein,Taz GoldsteinRobert Moniot,"After getting noticed by Miramax Pictures for his short film, a filmmaker has a moral dilemma when it comes up to facing the truth about the work he may (or may not) have made.",21m,The Dancing Cow
216,8.3,--,Jimmy Zeilinger,Jimmy Zeilinger,"Alfie is the brother no one notices, and at his hot-shot brother Richard's wedding, Alfie's father insults him, his brother puts him down, he gets fired, and he falls off a second-story ledge to his death. He's in line to enter Heaven, when the Devil recruits him. The deal: go back to Earth, break all Ten Commandments in an hour, and get to join the big, eternal party... Read all",18m,Damned If You Do
217,7.0,--,Jamie Goold,Jamie GooldJohnny Vaughan,A man with a hangover loses an important computer disk and blames his girlfriend.,9m,The Rules of Engagement
218,--,--,Maria Brenner,Maria Brenner,Add a plot,--,Dressing the Nelsons
219,--,--,Enda Hughes,Enda Hughes,"Silent movie classic Battleship Potemkin, re-imagined in the style of a video game.",3m,Comm-Raid on the Potemkin
