,IMDB,RT,Direccion,Guión,Argumento,Duración,Título
486,--,--,Monty Nyahay,Monty Nyahay,"Two American friends, Luis and Marvell, find more than leisure while on vacation in San Lorenzo, Honduras. With a chance to find Mayan gold, their friendship is tested and lives are at stake in this adventure of a lifetime.",17m,Isle of Fortune
487,--,--,Noomi Spook,Noomi Spook,Add a plot,--,Annabelle's Teaparty
488,--,--,Alonso Llosa,Alonso Llosa,"Alex, an avid womanizer, is abandoned by his talking penis, Betico, who threatens never to come back unless Alex gets back with Andrea, the love of his life. Told in a deadpan, yet inevitably comedic tone, Separated is a story about loss, growing up, and the ancient battle between lust and love.",10m,Separated
489,7.1,--,Calum MacDiarmid,Alexei Slater,A postman lets us into his dark world in quiet suburbia.,6m,82
490,6.3,--,João GarciaJoão RodriguesFrancisco Manuel Sousa,Luís Paulo GonçalvesJoão RodriguesFrancisco Manuel Sousa,"Zé Barata, a National Beer Union special agent, recalls is years as a rookie, specially his duel with Jorge the Terrible, as he passes the torch to his younger brother - agent Chico Barata.",10m,Cool
491,6.7,--,Selma Vilhunen,Kirsikka Saari,"A chaotic morning in a family with kids, and a mother who is determined that it's best to take care of everything herself.",7m,Pitääkö mun kaikki hoitaa?
492,6.6,--,--,--,--,8m,Jamón
493,--,--,John Tomkins,Tom MenaryJohn Tomkins,"A day in the life of Bob and his rather strange family. After a family argument, Bob makes his way to his 200th job interview that has a rather unfortunate deadly twist.",--,A Dark Tale
494,--,33%,Jaclyn Gramigna,Jaclyn Gramigna,"What happens when a girl has a very private moment, in a very public place?",3m,Downtown
495,--,--,Vanessa Hope,Vanessa Hope,"This short documentary takes its cue from an interview with Chinese author, Yu Hua, about his latest book, ""China in Ten Words, "" focusing in on anecdotes and stories for three of his words, ""Leader, "" ""Revolution, "" and ""Disparity.""",15m,China in Three Words
496,--,--,Paul Rothbart,Cooper CampbellPaul Rothbart,"When the wife of a successful writer/director of popular romantic comedies complains about the lack of romance in their marriage, her husband accommodates her the only way he knows how.",14m,Isn't It Romantic?
497,7.2,--,Mitch Rouse,Jay LeggettDavid PasquesiMitch Rouse,"Gary is falsely accused of beating his insane ex-girlfriend Charlotte, and he is sentenced to 30 days in Merkin Penal, a privately run prison. Once behind bars he runs into his old friend Smitty, who's in the 2nd year of his 9 month stay, due to a run in with the TSA. Smitty is ""insane Charlotte's"" older brother. Smitty and Gary met while Gary and Charlotte were an it... Read all",24m,Merkin Penal
498,7.3,--,Jeremy Cohen,Jeremy CohenStephanie Hunt,A short film about what happens when you get too good at meditating.,14m,Dalai Lama
499,7.4,--,Emilia ReidDominique Haidar,Dominique Haidar,"A gentleman waits for his dinner party guests to arrive, but something seems to be keeping them.",6m,The Dinner Party
500,--,--,Frazer Bradshaw,J. Hugo Fat,A human toddler turned bee wanders the emotional landscape of time and meaning.,5m,Spend My Days in Ecstasy
501,--,--,Eddy van Hamersveld,Eddy van Hamersveld,A desperate man calls his ex by videophone a day before Christmas. He tries to get a conversation. But the ex appears not very cooperative as something that happened in the past stands in between them as an obstacle most likely never to overcome.,1m,Sorrow B4 Christmas
502,7.2,--,Julien BocabeilleFrançois-Xavier ChaniouxOlivier Delabarre,Julien BocabeilleFrançois-Xavier ChaniouxOlivier Delabarre,Two Octopi fight for their lives with a stubborn restaurant cook in a comical escape through the streets of a small Greek village.,3m,Oktapodi
503,--,--,--,--,--,27m,Canvas of Blood
504,--,--,Anne Welles,Anne Welles,"Curtis (not the sharpest tool in the shed) goes out for a walk one day and falls in love with a beautiful woman named Ckandy (yes, she spells her name this way). As many have before him, Curtis blatantly overlooks Ckandy's over-abundance of baggage, and quickly marries her. We leave him walking off into the sunset to start his new (and much-altered) life as a married ... Read all",15m,Curtis Takes a Wrong Turn
505,--,--,David De la Garza Villarreal,David De la Garza Villarreal,"Yony 'Marbles' guards a safe house where they have someone kidnapped, but in organized crime no one is ever safe.",17m,Tantita muerte
506,--,--,Jan Santroch,Jan Santroch,"Alice and Tonda are trying to solve their marriage crisis more or less in the usual way. Their infidelities start to overwhelm them. They decide to sort things out right on the day of their wedding anniversary. Suddenly a man without guilt comes... Short film Sex, Lies and Flowers is a black dramatic irony, a mosaic story set in contemporary Prague during a single day... Read all",22m,Sex. Lies and Flowers
507,--,--,Thomas Florek,Thomas FlorekDouglas Gentile,"In the 1980s, Paul McCartney and Stevie Wonder famously pointed out that Ebony and Ivory can work together and be productive. We continue this useful trick of metaphors to explain our culture's glorification of phoniness. I'm sure that Mr. McCartney and Mr. Wonder are quite envious.",4m,Particle Board and Cherry Veneer
508,7.8,--,Burleigh Smith,Burleigh Smith,Melvin gives dating advice to his three-year-old son.,7m,The Things My Father Never Taught Me
509,--,--,Bernadette Keys,Bernadette Keys,Former teen idol Bobby Birdhouse has been living in obscurity after a catastrophic performance at Funbury '72 where he was booed off the stage during a crippling bout of stage fright. Many flashbacks later Bobby is offered to headline at small-time rock festival Woodrock. Will Bobby get back in the game or will he fly the coop once more? For Birdhouse it seems the roa... Read all,13m,Comeback
510,--,--,Mohamed Ben Becher,Mohamed Ben Becher,"In a bar, a group of friends are having a conversation about marriage, where two of them project themselves in its illusions and disappointments.",10m,All the Best
511,--,--,Donovan Alonso-Garcia,Donovan Alonso-Garcia,"Total blackout for Carole this morning. She wakes up in the middle of an entirely empty run down church.She is propelled in a strange situation, surrounded by strangers and later finds herself handcuffed by force to another stranger: Fayssal. Carole is about to live the worst day of her life. One of these days when the entire universe seems to hold it against you, wha... Read all",24m,Worst Case Scenario
512,--,--,Andrew Wilson,Andrew Wilson,"Love. For Shane, it is simply complicated.",9m,A True Love Story
513,--,--,Alina Polichuk,Alina Polichuk,"Three friends, a brother with a sister and their girlfriend, staged a not sickly party at the bowling club during which Anya saw her boyfriend, who had recently changed her with some kind of fat cow. Jealousy in the intoxicated brain flashed fire and the short film heroine decided to stab him with a fork in the eye, but her brother and sister, like real friends, came ... Read all",23m,145th kilometer
514,--,--,Azod Abedikichi,Azod AbedikichiJoshua N. Evans,The story of a wooden man who befriends his breakfast and is then called upon to become a hero.,8m,Baby Chicken
515,6.8,--,Brett Sørem,Sunah Bilsted,A dark comedy about how a life can be ruined in 140 characters.,11m,#twitterkills
516,--,--,Dallin Cerva,Hunter B. Phillips,"Jed and Tony are best friends and roommates. Much to Jed's disappointment,Tony is getting married and moving out. One morning Jed wakes up and finds Tony unconscious and hanging from his ceiling in a giant human cocoon. Tony eventually emerges with a new set of large wings. Jed must decide whether to allow Tony's metamorphosis to ruin his impending wedding day or help... Read all",15m,Your Cocoon and You
517,8.5,--,Mika'Ela FisherBen Feitelson,François GuibertLéa VignyBen Feitelson,"After nine years without celebrating their wedding anniversary,Gabrielle Montvignier ,heir of a fortune in decline,is invited by her husband to a supper to make up for the past nine years. Gabrielle has become a cold,wounded,cynical woman because of her gigolo type husband.nevertheless she accepts the invitation even though the relationship is dead. What she doesn't k... Read all",15m,Victory's Short
518,--,--,Dan Levy Dagerman,Elizabeth KimDan Levy DagermanSelina Ringel,A couples therapist struggles to save her own relationship when she stars on a reality show with her rock star husband.,19m,Real Love
519,--,--,Laurent ArdointStéphane Duprat,Laurent ArdointStéphane Duprat,September 1944. It's difficult for the Lieutenant Steve Douglas to reconcile his duty of soldier and his love life.,14m,Amour et Commando
520,--,29%,Alexander Hahn,Andi Lachs,,6m,The Collector
521,--,--,Marion BoukouarFrédéric LamboleyRenaud Mogenot,Marion BoukouarFrédéric LamboleyRenaud Mogenot,,6m,L'homme qu'on ne voyait pas
522,--,--,Leigh Turner,Leigh Turner,,7m,The Rhino Club
523,5.9,--,Constantine Krystallis,Constantine Krystallis,"When the old fisherman tries to convince his donkey to climb the steep winding road of their Greek island, he finds Mariza to be one suborn ass. But the old man knows that no one can resist Zorba's dance.",5m,Mariza
524,--,--,Charles BrennerJason R. Johnston,Charles Brenner,,10m,Mauris
525,--,--,Katharina Rivilis,Katharina Rivilis,'Joel & Jeanne' is a film about the fear of loneliness and being left behind. The siblings Joel and Jeanne are connected in a peculiar intimate way. Their relationship is put to a crucial test when they meet the charismatic Manuel at a wedding party.,27m,Joel & Jeanne
526,6.7,--,Jacob Ley,--,"For years the peas had been flocking to Granddads circus, to see the last Ice Flower the one only Granddad knew how to reveal. When Granddad decides to share his secret with his grandchild Humbug something goes horribly wrong; Humbug makes Granddad disappear together with the Ice Flower.",27m,The Secret of the Ice Flower
527,8.2,--,Moreen Littrell,Moreen Littrell,"MEET THE ZILLAS is a campy and absurdist short film set in Zillatown, a wedding-obsessed town where everyone wants to marry but not everyone is allowed.",23m,Meet the Zillas
528,7.2,--,Ana Almeida,Ana AlmeidaJosé Pedro Lopes,"On a spring night of 1999, two teenagers set out in an adventure to save the VHS.",17m,Video Store
529,--,--,A.D. Cooper,A.D. Cooper,Two bored boys try to harass an old man who gets around in a mobility scooter by cycling up to him and yelling in his face. His response is anything but predictable.,7m,Ace
530,--,--,Chia KamanakaAmy Rider,Amy Rider,Two roomies discover each is going on a first-date with the exact same man tonight...only an hour apart.,7m,Clappy
531,--,--,Sai Pramod Mohan,Sai Mohan,"A smoker discards all the cigarettes he's been hiding from his girlfriend to keep up with the promise he made to her, but craves for one last smoke after that. Will he find it?",10m,The Last One
532,6.9,--,Vivieno Caldinelli,H.P. LovecraftMatt Watts,"A crusty and recluse superintendent is thrown into the ultimate fight against evil when a pair of cultists open a portal to the ancient and mystical city of R'lyeh, awakening a slumbering god.",12m,Portal to Hell
533,7.5,--,Fidel Ruiz-Healy,Fidel Ruiz-Healy,"The story of a young, western-obsessed girl hell-bent on turning her quiet Texas suburb into the lawless playground of her imagination.",15m,A Band of Thieves
534,6.8,--,Alvaro Ron,Valentina PozzoliAlvaro RonClara Viola,"Sarah, a nerdy teenager, needs her mom's new car to go on a date with the boy she likes, but her mom won't let her drive the vehicle. She decides to steal it and go on her date, but something unexpected happens with the car that will change Sarah's life forever...",8m,The Red Thunder
535,6.8,--,Jake Mahaffy,Jake Mahaffy,A knight in armor rushes off on a (very) short quest.,3m,"A.D. 1363, the End of Chivalry"
536,6.1,--,Pierre Mazingarbe,Pierre Mazingarbe,"Like all women in Europe, Eva gives her menstrual blood to prolong the peace between humans and vampires. But Eva prefers a just war rather than peace unfair?",25m,Moonkup: Les noces d'Hémophile
537,--,--,Ryan Zaragoza,Ryan Zaragoza,A starving artist struggles to meet an impending deadline while his upstairs neighbor won't stop distracting him.,7m,The Painter
538,7.3,--,Tom Marshall,Tom Marshall,Alan (Johnny Vegas) searches for answers in all the wrong places and this time he thinks he's found them...on the internet in the form of a highly trained deadly assassin. But he's about to learn the true price of entering the 'dark_net'.,13m,Dark_Net
539,--,--,Galina Chakarova,Craig Walser,Two young lovers are having dinner and one of them is about to be served an unexpected desert menu.,5m,Some Fine Wine and You
540,6.5,--,Mike Clattenburg,Mike ClattenburgJohn Paul TremblayRobb Wells,"Two best friends, Rob and GW, spend a night out drinking before Rob moves away to start a new business.",30m,One Last Shot
541,--,--,Gonzalo Ladines,Gonzalo LadinesChristian Spies,,10m,Jacinta y la Sangre
542,7.9,--,Max Blustin,Max Blustin,Add a plot,3m,Swipe
543,7.3,--,Tony Hagger,Matt JL Wheeler,"Playing with the metro-sexuality of the modern male, two guys competitively argue about which of them is best mates with their mutual friend, Dave.",14m,Mancrush
544,--,--,Philip Marcus,Philip Marcus,A heartwarming story about a puppies.,7m,Puppy Size
545,--,--,Dave Rock,Fielding Edlow,Two needy narcissists bicker over what show to watch while being unsupportive of each other's aspirations in the entertainment industry.,8m,DVR
546,5.6,--,Michael Edward Staley,Michael Edward Staley,A day in the life of the Maintenance Division aboard an oppressive Space-Station.,26m,9:10 - 4:45
547,8.0,--,John Fitzpatrick,John Fitzpatrick,"During the Christmas season in Los Angeles, a lonely woman goes on a blind date unaware that her date is an active, notorious serial killer: The Brentwood Strangler.",18m,Brentwood Strangler
548,8.1,--,Joe Hitchcock,Joe Hitchcock,"A gun-loving woman aspires to cook breakfast for the man handcuffed to her bed, but first she has to stop a wild chicken from destroying everything.",9m,Stick to Your Gun
549,6.4,--,Isabelle Sieb,Nat Luurtsema,"Miranda and her daughters, Hester and Rose, are crammed in a rotting little caravan to be near their Gramps in his final days. They love him but his care bills are mounting and when they discover that he's hidden his savings.. they could bloody kill him.",16m,Three Women Wait for Death
550,6.7,--,Lisa Dash Donato,Lisa Dash DonatoRyan LoganFawzia Mirza,A man contemplates fatherhood when his older sister and her free-spirited wife ask him to be the sperm donor and uncle of their baby.,13m,Spunkle
551,7.7,--,Robert McKeon,Kevin BarryRobert McKeon,"All is well in the Prendergast household. Or, at least, that is what Jonathan Prendergast would have you believe. But his relationships with his wife and teenage daughter, and his own sanity, are put to the test when he becomes maniacally obsessed with driving off his daughter's handsome new boyfriend.",22m,Wifey Redux
552,6.9,--,Craig D. Foster,Craig D. FosterEmma McKenna,A man must race home before nightfall - or his terrible secret will be let loose.,9m,Overtime
553,6.2,--,Bethany Jacobson,Bethany Jacobson,"A down and out stand-up comedian finds refuge at Hotel Bleu, forging an off-beat partnership with a charismatic trumpet player half her age.",26m,Hotel Bleu
554,5.8,--,Tomas Heidar Johannesson,Tomas Heidar Johannesson,"A man finds himself mistakenly taken hostage by a troll-size debt collector and driven into the mountains. Things go from bad to considerably worse when a real troll shows up. Fortunately for the man, this particular troll is very particular about what she eats.",7m,Gryla
555,6.3,--,Adam DavisWill Corona Pilgrim,Adam DavisWill Corona Pilgrim,The most important rule. No Touching.,13m,No Touching
556,--,--,Jason Cunningham,Jason Cunningham,Add a plot,--,Introverts Anonymous
557,--,--,Nathaniel Goodman,Amelia Solomon,"A hedge fund manager dreams of writing the great American novel but can't find the time to complete it, so he decides to commit a crime and serve a two-year sentence where he's inspired by the real-life stories of his cellmates.",--,Jail Bound
558,--,--,Sagar Kalaria,--,"A story about many characters connected with each other due to random set of reasons. The film depicts how their lives are trapped in a loop due to those never ending ""five minutes"".",--,Bas Paanch Minute
559,--,--,Nora Särak,Nora Särak,,4m,First Kiss
560,--,71%,John CopemanDino Muccio,Dino Muccio,,--,Going Places
561,6.7,61%,Peter McDonald,Peter McDonald,"Ireland 1977. Eleven-year-old Damian Lynch (Scott Graham) is called in at the last moment to serve as an altar boy at an important mass in his local parish. Following his last appearance as an altar boy when he knocked Father O'Toole off the altar, Damien is serving a 3 month ban from his only passion in life...football. To make matters worse, Damian's team, Liverpool... Read all",11m,Pentecost
562,5.6,--,Arlen Konopaki,Arlen Konopaki,"In a desperate attempt to save her relationship, Emily convinces Chris to invite another man into their bed for a threesome. The encounter takes them on a wild ride that shakes their relationship to its very core.",9m,You Me Him & Us
563,8.0,86%,Cody Blue Snider,Cody Blue SniderShane Snider,"Fool's Day is a dark comedy about a 4th grade class that pull an innocent, April Fool's prank on their teacher...that accidentally kills her. Panicked and convinced they will go to prison, the blood splattered classmates try to cover up the murder and dispose of the body before their D.A.R.E. officer shows up for his weekly lesson.",19m,Fool's Day
564,8.5,--,Jeremy Weiss,Jeremy Weiss,Riff Raf is a lighthearted short film about a jazz trumpeter who accidentally ends up in a classical orchestra.,16m,Riff Raf
565,--,84%,Christopher Baum,Christopher Baum,A contract killer murders his partner's attractive new girlfriend after believing they have ties to his brother's death.,5m,Villains
566,8.8,--,Helen O'Hanlon,Helen O'Hanlon,Dare you find out what sort of villain you would be?,16m,How to Be a Villain
567,8.1,--,Valerio Attanasio,Valerio Attanasio,Sometimes you need to try unusual ways to start a family.,20m,Finché c'è vita c'è speranza
568,--,--,Daniel CodeNima GholamipourCameron MacLeod,Daniel CodeNima GholamipourCameron MacLeod,Recollection Cinema explores the history of shotgunning beer and talks to the man who invented this evolution in the art of drinking beer from a can.,--,The Inventor of Shotgunning Beer
569,--,--,Francis Villacañas,Francisco J. LópezFrancisco Ibáñez,Add a plot,40m,Mortadelo y Filemón contra el Imperio del O.C.H.I.O.
570,--,--,Bruno François-Boucher,Bruno François-BoucherDorothy Parker,Add a plot,13m,Life Together
571,--,--,Genaro Dominguez,Genaro Dominguez,Add a plot,--,Connie Saves Gilbert
572,--,--,Alexander Lony,Alexander Lony,Madame and Monsieur are back.,4m,Nebenbuhler
573,--,--,Mark J. Parker,Mark J. Parker,"Four college students reunite on a summer night at a house in the woods. As they tell scary stories around the campfire, the line between imagination and reality blurs, and they get the feeling they may not be alone on the property.",17m,Sticks
574,8.1,--,Brian Patrick Butler,Brian Patrick Butler,A vampire's deadly plan for his guests is jeopardized when his dimwitted servant ruins their dinner.,8m,The Phantom Hour
575,--,--,Robert Pralgo,Adam MinarovichRobert Pralgo,A small town bully tries to mug a Magician for his watch...TA DAAAA!,11m,Ta Daaaa: The Great Orecto
576,8.1,--,Chris London,Roxy BarrettChris LondonBrian Rifici,"Exploring guilt, self-loathing, and hiding dead bodies from your niece.",15m,Uncle Gareth
577,--,--,Asad K.M.,Tom Bragg,A thief on the run from drug dealers finds his escape in the form of a kooky taxi driver.,8m,Dark Town
578,--,--,Michael L. Howard,Michael L. Howard,,--,The Screw Ups
579,--,--,Sarah Hedar,Stevie JacksonJoan Macbeth,A routine job interview goes sideways when the applicant gets completely honest about what it's like to be an artist trapped in a corporate cubicle.,6m,Honestly Charlotte
580,--,--,Milan BarreroAudrey BehaanMerchx Dascomb,--,Add a plot,29m,The College
581,--,75%,Danny Caporaletti,Cavan Hallman,"On Christmas Eve, a neurotic man stays up late to kidnap Santa Claus and interrogate him about an alleged affair with his wife.",9m,Here Comes Santa Claus
582,--,--,Mustapha Haouem,Mustapha Haouem,"In the near future, drugs will take other forms and for each dealer his goods.",13m,Trip
583,9.9,--,Gabriele Fabbro,Gabriele Fabbro,Two young dreamers find themselves trapped in a journey to prove the existence of an old legend.,22m,The Waltz of the Monsters
584,--,--,Sean Patrick Kelly,Sean Patrick KellyNatalia Lopez-Woodside,A man with an uncontrollable Itch on his hand goes through increasingly extreme measures to get rid of it.,4m,Itch
585,6.9,--,Ryan Turner,Matthew HartRyan Turner,"In the year 2025, a young man's superintelligent AI system tells him that he must go on a date or face certain suicide from loneliness.",14m,A Date in 2025
586,--,--,Jørgen Egner Granerud,Jørgen Egner Granerud,"A married couple discovers squatters have moved into their cabin since they were last there, and tries to deal with the situation as conscientiously as they can.",13m,Vi bor her
587,--,--,Cecilia Kang,Cecilia Kang,"Lila is a young film director who is struggling to overcome the stupor of a blank sheet. One day, her boyfriend Candi comes with a new bicycle lock, a gift from a beautiful girl. This will force her to go outside searching for something new.",27m,Bicycles
588,--,--,Ryan C. Scott,Kevin PulliasRyan C. Scott,Add a plot,16m,The Treasure of the Knights of Anopha
589,--,--,Timo ZachariasSamuel Gheist,Carina ArltChristian Arlt,"Zombie Sabine lives in the world after the apocalypse, working in an advertising agency. When she meets her idol, she learns that there is a cure in the human zone. Now, nothing can stop Sabine from going on an adventure of her own.",41m,Everyday ZOMBIE
590,--,--,Jon Croft,Luke Sokolewicz,A wealthy Russian foot model known as 'Golden Foot' must reconcile with his mother after she falls victim to a strange disease brought-on by 'selfie' over-indulgence.,20m,Golden Foot
591,--,--,Harrison Houde,Zachary Gulka,"In an alternate era, Vinny, an awkward dreamer, falls deeply in love with the voice behind a particular album. Now he must go to extreme lengths to rid himself from reality and continue collecting his dream girl.",9m,Vinny's Girl
592,8.2,--,Matt Braunsdorf,Jonathan Marballi,A couple's relationship is turned upside down when they discover that their Uber driver is her old flame.,17m,Uber Ex
593,6.5,--,Brian Lonano,Victoria CookBrian Lonano,Three dorky American girls magically transform into beautiful Japanese Superheroes and fight a tampon monster as they begin their journey into womanhood.,14m,BFF Girls
594,--,--,Jan Bujnowski,Jan Bujnowski,A 55-year-old street performer from Poland is living a lonely life in London. His parents decide to pay him short visit after years of not seeing him.,26m,Wehikul czasu
595,6.6,--,Matthew Van Vorst,Jules Forsberg-LaryMatthew Van Vorst,"Jordan, a discontented night-shift employee at Priced-Less Supermarket, struggles with life, employment, and her own humanity as she transitions into a zombie during an otherwise normal shift.",15m,Zombied
596,--,--,Matías Nicieza,Séchu SendeMatías Nicieza,Add a plot,6m,Instrucciones para empezar a hablar gallego
597,8.4,--,Alex HelfrechtJörg Tittel,Alex HelfrechtGabriella MoranJörg Tittel,"When Boris and Olga arrive at the port of Dover with precious cargo, the border authorities, headed by the formidable Mrs. Pyke (Olivia Williams), uncover truths hidden - quite literally - within our protagonists.",12m,NYET! - a Brexit UK Border Farce
598,--,--,Wayne Kelly,Keith LargeMaria Smith,"When lovers, husband, sister, wife and mother all share their guilt through the same bunch of flowers, anarchic chaos ensues.",--,Guilty Bunch of Flowers
599,7.0,--,Eric Raunio,Eric Raunio,An aspiring picture artist goes to great lengths to produce just the right pieces for his upcoming show. Break a leg.,3m,Modern Art
600,--,--,Tetsuo Lumiere,Tetsuo LumiereDiego Recalde,Add a plot,--,Mil Formas de Destruir el Congreso Nacional - Avión
601,--,--,Ludovic Coutaud,Ludovic Coutaud,The unique and unusual encounter of two lonely souls.,27m,Le Destin Tragique de Bernadette Chérie
602,--,--,Vaudrey EtienneAnna Neva,Vaudrey EtienneThomas Mansuy,Add a plot,7m,Opetussatu
603,--,--,Evert Josemanders,Evert JosemandersJasper Staps,Add a plot,--,Irma
604,--,--,Bret Smith,Bret Smith,,4m,Rat-Face Burattino
605,7.7,--,Nathan Nill,Lena Krumkamp,"Maik just wants to get through his community service hours at the home for the disabled as quickly as possible. But he soon starts to wonder who really needs the support here - he himself, the disabled, or maybe even the social workers?",26m,Stufe Drei
606,--,--,Christophe Guyoton,Christophe Guyoton,A psychiatrist is more concerned with himself than to his patients.,17m,Affolant
607,--,--,Tom Delfino,Judy Klass,"John reads in the paper that, like suicide bombers, you have to shoot zombies in the head, otherwise they still pose a threat. Too bad for John and his wife Kelly that they didn't shoot his zomboid sister...",8m,Night of the Living Relatives
608,6.4,93%,David Lynch,David Lynch,"In a locked down train station, a homicide detective conducts an interview with a tormented monkey.",17m,What Did Jack Do?
609,--,--,Christophe Guyoton,Christophe Guyoton,A father and his daughter decide to become psychiatrists in order to pay rent.,16m,Démentiel
